{
  "schemaVersion": "1.0.0",
  "catalogId": "mediatranscribestudio.portable-model-catalog",
  "sourceRegistryId": "mediatranscribestudio.local-models",
  "artifactPolicy": {
    "bundledModelArtifacts": false,
    "absolutePathsIncluded": false
  },
  "defaults": {
    "semanticModelId": "ollama-qwen3.5-27b-q4-k-m",
    "speakerVerifierModelId": "eres2netv2"
  },
  "hardwareProfiles": [
    {
      "id": "windows-rtx3060-12gb",
      "platform": "windows-x86_64"
    }
  ],
  "models": [
    {
      "id": "qwen3-asr-1.7b",
      "displayName": "Qwen3-ASR 1.7B",
      "source": {
        "provider": "modelscope",
        "repository": "Qwen/Qwen3-ASR-1.7B",
        "revision": "master"
      },
      "license": {
        "spdx": "Apache-2.0",
        "evidencePath": "README.md",
        "evidenceSha256": "5058416891bc47a2051557765997e8c42f8eb78a0e33c3e775bd17d4b0ba4d50"
      },
      "usage": {
        "status": "production",
        "roles": [
          "automatic-speech-recognition"
        ],
        "decisionPolicy": "direct"
      },
      "runtime": {
        "engine": "qwen-asr",
        "version": "0.0.6",
        "executablePath": "runtime/media-asr/python",
        "accelerator": "cuda:0",
        "artifactFormat": "safetensors"
      },
      "quantization": {
        "scheme": "not-declared",
        "evidencePath": ".mts-model-manifest.json"
      },
      "hardwareProfileIds": [
        "windows-rtx3060-12gb"
      ],
      "download": {
        "destinationRelative": "models/qwen/Qwen3-ASR-1.7B-resharded-768MiB",
        "requiresModelManager": true
      }
    },
    {
      "id": "qwen3-forced-aligner-0.6b",
      "displayName": "Qwen3 ForcedAligner 0.6B",
      "source": {
        "provider": "modelscope",
        "repository": "Qwen/Qwen3-ForcedAligner-0.6B",
        "revision": "master"
      },
      "license": {
        "spdx": "Apache-2.0",
        "evidencePath": "README.md",
        "evidenceSha256": "5058416891bc47a2051557765997e8c42f8eb78a0e33c3e775bd17d4b0ba4d50"
      },
      "usage": {
        "status": "production",
        "roles": [
          "forced-alignment",
          "timestamp-refinement"
        ],
        "decisionPolicy": "direct"
      },
      "runtime": {
        "engine": "qwen-asr",
        "version": "0.0.6",
        "executablePath": "runtime/media-asr/python",
        "accelerator": "cuda:0",
        "artifactFormat": "safetensors"
      },
      "quantization": {
        "scheme": "not-declared",
        "evidencePath": ".mts-model-manifest.json"
      },
      "hardwareProfileIds": [
        "windows-rtx3060-12gb"
      ],
      "download": {
        "destinationRelative": "models/qwen/Qwen3-ForcedAligner-0.6B-resharded-768MiB",
        "requiresModelManager": true
      }
    },
    {
      "id": "funasr-fsmn-vad",
      "displayName": "FunASR FSMN VAD",
      "source": {
        "provider": "modelscope",
        "repository": "iic/speech_fsmn_vad_zh-cn-16k-common-pytorch",
        "revision": "v2.0.4"
      },
      "license": {
        "spdx": "Apache-2.0",
        "evidencePath": "README.md",
        "evidenceSha256": "6fc838ef6b23aef579ac9001c3d098941ff1d37b800efc0bd25e455309edcb37"
      },
      "usage": {
        "status": "production",
        "roles": [
          "voice-activity-detection"
        ],
        "decisionPolicy": "direct"
      },
      "runtime": {
        "engine": "funasr",
        "version": "1.3.1",
        "executablePath": "runtime/media-asr/python",
        "accelerator": "cpu",
        "artifactFormat": "pytorch-checkpoint"
      },
      "quantization": {
        "scheme": "not-declared",
        "evidencePath": ".mts-model-manifest.json"
      },
      "hardwareProfileIds": [
        "windows-rtx3060-12gb"
      ],
      "download": {
        "destinationRelative": "models/funasr/fsmn-vad",
        "requiresModelManager": true
      }
    },
    {
      "id": "campplus",
      "displayName": "CAM++ Chinese Common",
      "source": {
        "provider": "modelscope",
        "repository": "iic/speech_campplus_sv_zh-cn_16k-common",
        "revision": "v2.0.2"
      },
      "license": {
        "spdx": "Apache-2.0",
        "evidencePath": "README.md",
        "evidenceSha256": "9bd58b989a534fa0121c8d10e62c0cce9080a9a9aeb2499bb429676f9c17cc3a"
      },
      "usage": {
        "status": "production",
        "roles": [
          "primary-speaker-embedding"
        ],
        "decisionPolicy": "direct"
      },
      "runtime": {
        "engine": "funasr",
        "version": "1.3.1",
        "executablePath": "runtime/media-asr/python",
        "accelerator": "cuda:0",
        "artifactFormat": "pytorch-checkpoint"
      },
      "quantization": {
        "scheme": "not-declared",
        "evidencePath": ".mts-model-manifest.json"
      },
      "hardwareProfileIds": [
        "windows-rtx3060-12gb"
      ],
      "download": {
        "destinationRelative": "models/funasr/campplus",
        "requiresModelManager": true
      }
    },
    {
      "id": "eres2netv2",
      "displayName": "ERes2NetV2 Chinese Common",
      "source": {
        "provider": "modelscope",
        "repository": "iic/speech_eres2netv2_sv_zh-cn_16k-common",
        "revision": "v1.0.2"
      },
      "license": {
        "spdx": "Apache-2.0",
        "evidencePath": "README.md",
        "evidenceSha256": "f2201730b0695c039839a4f41343fb81e518e60ba7be59935740c92072bebbb6"
      },
      "usage": {
        "status": "production",
        "roles": [
          "secondary-speaker-verification"
        ],
        "decisionPolicy": "evidence-only"
      },
      "runtime": {
        "engine": "modelscope",
        "version": "1.38.1",
        "executablePath": "runtime/media-asr/python",
        "accelerator": "gpu",
        "artifactFormat": "pytorch-checkpoint"
      },
      "quantization": {
        "scheme": "not-declared",
        "evidencePath": ".mts-model-manifest.json"
      },
      "hardwareProfileIds": [
        "windows-rtx3060-12gb"
      ],
      "download": {
        "destinationRelative": "models/modelscope/eres2netv2",
        "requiresModelManager": true
      },
      "deploymentSlots": [
        {
          "id": "secondary-speaker-verification",
          "adapterIds": [
            "modelscope-eres2netv2"
          ]
        }
      ]
    },
    {
      "id": "eres2netv2-w24s4ep4",
      "displayName": "ERes2NetV2 w24s4ep4",
      "source": {
        "provider": "modelscope",
        "repository": "iic/speech_eres2netv2w24s4ep4_sv_zh-cn_16k-common",
        "revision": "v1.0.1"
      },
      "license": {
        "spdx": "Apache-2.0",
        "evidencePath": "README.md",
        "evidenceSha256": "3e16e90a6f020a93a9dcbc5befa4d76132e983103345267e7692533d792c6823"
      },
      "usage": {
        "status": "challenger",
        "roles": [
          "chinese-speaker-embedding"
        ],
        "decisionPolicy": "challenger-only"
      },
      "runtime": {
        "engine": "modelscope",
        "version": "1.38.1",
        "executablePath": "runtime/media-asr/python",
        "accelerator": "gpu",
        "artifactFormat": "pytorch-checkpoint"
      },
      "quantization": {
        "scheme": "not-declared",
        "evidencePath": ".mts-model-manifest.json"
      },
      "hardwareProfileIds": [
        "windows-rtx3060-12gb"
      ],
      "download": {
        "destinationRelative": "models/modelscope/eres2netv2w24s4ep4",
        "requiresModelManager": true
      },
      "deploymentSlots": [
        {
          "id": "secondary-speaker-verification",
          "adapterIds": [
            "modelscope-eres2netv2"
          ]
        }
      ]
    },
    {
      "id": "pyannote-community-1",
      "displayName": "Pyannote Speaker Diarization Community-1",
      "source": {
        "provider": "huggingface",
        "repository": "pyannote-community/speaker-diarization-community-1",
        "revision": "8a527374977391da736e0daaef26855d949d9685"
      },
      "license": {
        "spdx": "CC-BY-4.0",
        "evidencePath": "README.md",
        "evidenceSha256": "2db91f9265bd81f1653ff088b5bff22bf6aebebea03328513af65501643f8a31"
      },
      "usage": {
        "status": "production",
        "roles": [
          "diarization-baseline",
          "overlap-evidence",
          "timeline-fallback"
        ],
        "decisionPolicy": "fallback-only"
      },
      "runtime": {
        "engine": "pyannote-audio",
        "version": "4.0.4",
        "executablePath": "runtime/media-asr/python",
        "accelerator": "cuda",
        "artifactFormat": "pytorch-checkpoint"
      },
      "quantization": {
        "scheme": "not-declared",
        "evidencePath": ".mts-model-manifest.json"
      },
      "hardwareProfileIds": [
        "windows-rtx3060-12gb"
      ],
      "download": {
        "destinationRelative": "models/pyannote/speaker-diarization-community-1",
        "requiresModelManager": true
      }
    },
    {
      "id": "wespeaker-redimnet2-b6-lm",
      "displayName": "WeSpeaker ReDimNet2 B6 LM",
      "source": {
        "provider": "huggingface",
        "repository": "Wespeaker/wespeaker-voxceleb-redimnet2-B6-LM",
        "revision": "e34354de2429a45894905bd58c24c22250485b9a"
      },
      "license": {
        "spdx": "Apache-2.0",
        "evidencePath": "README.md",
        "evidenceSha256": "98b45ea81164d1e1a1dd82255207053b15cd6c69d922a1c5cf3387ce604d4b74"
      },
      "usage": {
        "status": "challenger",
        "roles": [
          "cross-domain-speaker-embedding"
        ],
        "decisionPolicy": "challenger-only"
      },
      "runtime": {
        "engine": "wespeaker",
        "version": "0.0.1",
        "executablePath": "runtime/media-asr/python",
        "accelerator": "cuda:0",
        "artifactFormat": "pytorch-checkpoint"
      },
      "quantization": {
        "scheme": "not-declared",
        "evidencePath": ".mts-model-manifest.json"
      },
      "hardwareProfileIds": [